{
  "schema_version": "0.1.0",
  "record_type": "normalized",
  "product_id": "p_7df6497269eb4b70",
  "source": {
    "url": "https://thinkingmu.com/en/products/white-hemp-jules-shirt",
    "canonical_url": "https://thinkingmu.com/en/products/white-hemp-jules-shirt",
    "merchant": "Thinking MU",
    "merchant_domain": "thinkingmu.com",
    "scraped_at": "2026-09-29T22:36:35Z",
    "language": "en"
  },
  "identity": {
    "brand": "Thinking MU",
    "product_name": "White hemp Jules shirt",
    "product_type": "short_sleeve_shirt",
    "subcategory": null,
    "audience": "men"
  },
  "content": {
    "title": "Sustainable Shirt White Hemp Jules Man | Thinking Mu",
    "full_description": "Jules white hemp shirt\n→ V-neckline with shirt collar\n→ Short sleeves\n→ Regular fit\n→ Front closure with buttons\n→ Fabric: hemp mixed with tencel, weight 135 gsm (Lightweight fabric)\n→ Length of garment: Regular\nRef: MSH00210\nMeasurements in size M: 72 cm total length, 49 cm back width and 24 cm sleeve length.\nHemp is an exceptional plant that provides one of the lightest and most breathable sustainable fibers. Main features:\nLESS WATER: It needs 95% less water than cotton and produces 2.5 times more fiber.\nLESS C02: Its cultivation in the field helps the CO2 absorption process.\nLESS PESTICIDES: It does not require the use of chemical pesticides or fertilizers for its cultivation.\nLESS TIME: It is a renewable fiber that grows quickly and vigorously in a wide variety of climates.\nLESS WASTE: The plant produces 250% more fiber than cotton and 600% more than flax using the same area of land.\nLESS CROP: The area required for cultivation is almost half that of cotton.\nLESS SOIL EROSION: Prevents soil erosion caused by logging.\nThe model is 176cm tall and wears a size M.",
    "short_description": null,
    "bullet_points": [
      "V-neckline with shirt collar",
      "Short sleeves",
      "Regular fit",
      "Front closure with buttons",
      "Fabric: hemp mixed with tencel, weight 135 gsm (Lightweight fabric)",
      "Length of garment: Regular"
    ],
    "meta_title": "Sustainable Shirt White Hemp Jules Man | Thinking Mu",
    "meta_description": "Discover the Shirt White Hemp Jules by Thinking MU, made with hemp and certified by GOTS, OCS y GRS. Man sustainable fashion with Mediterranean inspiration.",
    "h1": "White hemp Jules shirt"
  },
  "materials": {
    "primary_material": "hemp",
    "material_percentages": {
      "hemp": 55,
      "other": 45
    },
    "fabric_type": null,
    "fabric_weight_gsm": 135,
    "fabric_weight_raw": "135 gsm",
    "stretch": null,
    "texture": null
  },
  "fit_and_style": {
    "fit": "regular",
    "neckline": "v_neck",
    "collar_type": "shirt collar",
    "sleeve_length": "short",
    "shirt_length": "regular",
    "pattern": null,
    "style": null
  },
  "variants": {
    "product_group_id": "14828248170822",
    "colors": [
      {
        "original_color_name": "Snow White",
        "normalized": "white"
      }
    ],
    "sizes": [
      {
        "raw_size": "XS",
        "normalized_size": "XS"
      },
      {
        "raw_size": "S",
        "normalized_size": "S"
      },
      {
        "raw_size": "M",
        "normalized_size": "M"
      },
      {
        "raw_size": "L",
        "normalized_size": "L"
      },
      {
        "raw_size": "XL",
        "normalized_size": "XL"
      },
      {
        "raw_size": "XXL",
        "normalized_size": "XXL"
      }
    ],
    "variant_count": 6,
    "items": [
      {
        "variant_id": "v_0f12d902379f969d",
        "merchant_variant_id": "53853668835654",
        "color": "Snow White",
        "size": "XS",
        "sku": "8435512906724",
        "gtin": "8435512906724",
        "mpn": null,
        "price": 99.9,
        "currency": "EUR",
        "availability": "out_of_stock"
      },
      {
        "variant_id": "v_d98758aad8e51942",
        "merchant_variant_id": "53853668868422",
        "color": "Snow White",
        "size": "S",
        "sku": "8435512901828",
        "gtin": "8435512901828",
        "mpn": null,
        "price": 99.9,
        "currency": "EUR",
        "availability": "out_of_stock"
      },
      {
        "variant_id": "v_de4bce113f17771d",
        "merchant_variant_id": "53853668901190",
        "color": "Snow White",
        "size": "M",
        "sku": "8435512901835",
        "gtin": "8435512901835",
        "mpn": null,
        "price": 99.9,
        "currency": "EUR",
        "availability": "out_of_stock"
      },
      {
        "variant_id": "v_0cce17323b5370a7",
        "merchant_variant_id": "53853668933958",
        "color": "Snow White",
        "size": "L",
        "sku": "8435512901842",
        "gtin": "8435512901842",
        "mpn": null,
        "price": 99.9,
        "currency": "EUR",
        "availability": "out_of_stock"
      },
      {
        "variant_id": "v_c8175a1f07f345c5",
        "merchant_variant_id": "53853668966726",
        "color": "Snow White",
        "size": "XL",
        "sku": "8435512901859",
        "gtin": "8435512901859",
        "mpn": null,
        "price": 99.9,
        "currency": "EUR",
        "availability": "out_of_stock"
      },
      {
        "variant_id": "v_9b0626a4195bafe4",
        "merchant_variant_id": "53853668999494",
        "color": "Snow White",
        "size": "XXL",
        "sku": "8435512901866",
        "gtin": "8435512901866",
        "mpn": null,
        "price": 99.9,
        "currency": "EUR",
        "availability": "out_of_stock"
      }
    ]
  },
  "features": [
    "Front closure with buttons"
  ],
  "care": [
    "MACHINE WASH AT 30º WITH REDUCED MECHANICAL ACTION",
    "DO NOT BLEACH",
    "DO NOT TUMBLE DRY",
    "IRON AT LOW TEMPERATURE",
    "DOES NOT ALLOW DRY CLEANING"
  ],
  "commerce": {
    "price": 99.9,
    "sale_price": null,
    "currency": "EUR",
    "availability": "out_of_stock",
    "rating": null,
    "review_count": null,
    "sku": null,
    "gtin": null,
    "mpn": null
  },
  "structured_data": {
    "product_schema_present": true,
    "offer_schema_present": true,
    "product_group_present": true,
    "raw_json_ld": [
      {
        "@context": "http://schema.org",
        "@type": "Organization",
        "name": "Thinking MU",
        "logo": "https://thinkingmu.com/cdn/shop/files/logo.svg?v=1756332168&width=500",
        "sameAs": [
          "",
          "",
          "",
          "",
          "",
          "",
          "",
          "",
          ""
        ],
        "url": "https://thinkingmu.com"
      },
      {
        "@context": "https://schema.org",
        "@type": "BreadcrumbList",
        "itemListElement": [
          {
            "@type": "ListItem",
            "position": 1,
            "name": "Thinking MU",
            "item": "https://thinkingmu.com/en"
          },
          {
            "@type": "ListItem",
            "position": 2,
            "name": "White hemp Jules shirt",
            "item": "https://thinkingmu.com/en/products/white-hemp-jules-shirt"
          }
        ]
      },
      {
        "@context": "http://schema.org/",
        "@id": "/en/products/white-hemp-jules-shirt#product",
        "@type": "ProductGroup",
        "brand": {
          "@type": "Brand",
          "name": "Thinking MU"
        },
        "category": "Shirts",
        "description": "Jules white hemp shirt\n→ V-neckline with shirt collar→ Short sleeves→ Regular fit→ Front closure with buttons→ Fabric: hemp mixed with tencel, weight 135 gsm (Lightweight fabric)→ Length of garment: RegularRef: MSH00210Measurements in size M: 72 cm total length, 49 cm back width and 24 cm sleeve length.Hemp is an exceptional plant that provides one of the lightest and most breathable sustainable fibers. Main features:\n \n \n LESS WATER: It needs 95% less water than cotton and produces 2.5 times more fiber.\n \n \n LESS C02: Its cultivation in the field helps the CO2 absorption process.\n \n \n LESS PESTICIDES: It does not require the use of chemical pesticides or fertilizers for its cultivation.\n \n \n LESS TIME: It is a renewable fiber that grows quickly and vigorously in a wide variety of climates. \n \n \n LESS WASTE: The plant produces 250% more fiber than cotton and 600% more than flax using the same area of land. \n \n \n LESS CROP: The area required for cultivation is almost half that of cotton.\n \n \n LESS SOIL EROSION: Prevents soil erosion caused by logging.\n \n ",
        "hasVariant": [
          {
            "@id": "/en/products/white-hemp-jules-shirt?variant=53853668835654#variant",
            "@type": "Product",
            "gtin": "8435512906724",
            "image": "https://thinkingmu.com/cdn/shop/files/MSH00210_0.jpg?v=1741708633&width=1920",
            "name": "White hemp Jules shirt - XS",
            "offers": {
              "@id": "/en/products/white-hemp-jules-shirt?variant=53853668835654#offer",
              "@type": "Offer",
              "availability": "http://schema.org/OutOfStock",
              "price": "99.90",
              "priceCurrency": "EUR",
              "url": "https://thinkingmu.com/en/products/white-hemp-jules-shirt?variant=53853668835654"
            },
            "sku": "8435512906724"
          },
          {
            "@id": "/en/products/white-hemp-jules-shirt?variant=53853668868422#variant",
            "@type": "Product",
            "gtin": "8435512901828",
            "image": "https://thinkingmu.com/cdn/shop/files/MSH00210_0.jpg?v=1741708633&width=1920",
            "name": "White hemp Jules shirt - S",
            "offers": {
              "@id": "/en/products/white-hemp-jules-shirt?variant=53853668868422#offer",
              "@type": "Offer",
              "availability": "http://schema.org/OutOfStock",
              "price": "99.90",
              "priceCurrency": "EUR",
              "url": "https://thinkingmu.com/en/products/white-hemp-jules-shirt?variant=53853668868422"
            },